File,Sent_ID,Sentence,Length,Word Order,Category,dependency length../Dialouge Corpus Filttered/parse_gold_filttered\Phase2\Phase2_gold\hi_2142_gold.conllu,568,अरे गोखले को मैं ने आज फ़ोन करने की कोशिश की थी ।,13,OSV,Transitive,3.5454545454545454
../Dialouge Corpus Filttered/parse_gold_filttered\Phase2\Phase2_gold\hi_2142_gold.conllu,584,बट वो जाना चाह नहीं रहा है ।,8,SOV,Transitive,2.0
../Dialouge Corpus Filttered/parse_gold_filttered\Phase2\Phase2_gold\hi_2142_gold.conllu,651,पर हम लोग अभी तक इतने लोगों के नाम ले चुके हैं कि कोई चाहे तो हमें ट्रेस जरूर कर सकता है ।,23,SOV,Transitive,3.238095238095238
../Dialouge Corpus Filttered/parse_gold_filttered\Phase2\Phase2_gold\hi_2142_gold.conllu,672,तो वो बोला तो मौंटी न्यू ईयर पे क्या कर रहा है ।,13,SOV,Transitive,2.727272727272727
../Dialouge Corpus Filttered/parse_gold_filttered\Phase2\Phase2_gold\hi_2142_gold.conllu,703,तो मैं ने कोहले को बोला ।,7,SOV,Transitive,2.6
../Dialouge Corpus Filttered/parse_gold_filttered\Phase2\Phase2_gold\hi_2142_gold.conllu,709,पंजू इंडिया में रेड्डी को मिला हॉस्टल में ।,9,SOV,Transitive,2.142857142857143
../Dialouge Corpus Filttered/parse_gold_filttered\Phase2\Phase2_gold\hi_2142_gold.conllu,710,रेड्डी ने मेरे को बोला ।,6,SOV,Transitive,2.0
../Dialouge Corpus Filttered/parse_gold_filttered\Phase2\Phase2_gold\hi_2142_gold.conllu,711,मैं ने कोहले को पूछा ।,6,SOV,Transitive,2.0
../Dialouge Corpus Filttered/parse_gold_filttered\Phase2\Phase2_gold\hi_2142_gold.conllu,712,कोहले ने खंबा को पूछा ।,6,SOV,Transitive,2.0
../Dialouge Corpus Filttered/parse_gold_filttered\Phase2\Phase2_gold\hi_2142_gold.conllu,720,लेकिन खंबा ने ये भी बोला कि वो शायद वापस आना चाहता है ।,14,SOV,Transitive,3.0
../Dialouge Corpus Filttered/parse_gold_filttered\Phase2\Phase2_gold\hi_2142_gold.conllu,720,लेकिन खंबा ने ये भी बोला कि वो शायद वापस आना चाहता है ।,14,SOV,Transitive,3.0
../Dialouge Corpus Filttered/parse_gold_filttered\Phase2\Phase2_gold\hi_2142_gold.conllu,730,वो तो साला दिन रात मेल ही भेजता रहता है ।,11,SOV,Transitive,2.0
../Dialouge Corpus Filttered/parse_gold_filttered\Phase2\Phase2_gold\hi_2142_gold.conllu,736,बिकॉज़ मैं ने उस की 2 3 पोस्टिंग पढ़ी रेड डॉट स्पोर्ट डॉट क्रिकेट पे ।,16,SOV,Transitive,2.857142857142857
../Dialouge Corpus Filttered/parse_gold_filttered\Phase2\Phase2_gold\hi_2142_gold.conllu,824,ऐंड उस को जनता ने सपोर्ट किया था ।,9,OSV,Transitive,2.5714285714285716
../Dialouge Corpus Filttered/parse_gold_filttered\Phase2\Phase2_gold\hi_2142_gold.conllu,886,साले तू क्या क्या खबर रखता है ।,8,SOV,Transitive,2.3333333333333335
../Dialouge Corpus Filttered/parse_gold_filttered\Phase2\Phase2_gold\hi_2142_gold.conllu,891,कोई ना कोई हॉस्टल से मेल भेजता है ।,9,SOV,Transitive,2.142857142857143
../Dialouge Corpus Filttered/parse_gold_filttered\Phase2\Phase2_gold\hi_2142_gold.conllu,894,रेड्डी पैसों के लिए लगता है काफ़ी कुछ कर रहा है ।,12,SOV,Transitive,2.8
../Dialouge Corpus Filttered/parse_gold_filttered\Phase2\Phase2_gold\hi_2148_gold.conllu,62,वो मेसेज तुझे भी सुनाई दिया था क्या ।,9,OSV,Transitive,1.8571428571428572
../Dialouge Corpus Filttered/parse_gold_filttered\Phase2\Phase2_gold\hi_2148_gold.conllu,77,तो आज अगर अभी भेज देगा ना तो कल मॉर्निंग में वो पढ़ के फ़िर तेरे को 1 पिन भेज देगा शाम तक ।,24,S-IO-O-V,Ditransitive,3.8181818181818183
../Dialouge Corpus Filttered/parse_gold_filttered\Phase2\Phase2_gold\hi_2148_gold.conllu,97,मेरे को 5 6 मिला ।,6,SOV,Transitive,1.75
../Dialouge Corpus Filttered/parse_gold_filttered\Phase2\Phase2_gold\hi_2148_gold.conllu,112,उस में तो मैं क्रैक किया हूँ ऑल्वेज़ ।,9,SOV,Transitive,2.0
../Dialouge Corpus Filttered/parse_gold_filttered\Phase2\Phase2_gold\hi_2148_gold.conllu,120,प्रॉजेक्ट में मैं ने सी प्रोग्रैम तो कर चुका हूँ ।,11,SOV,Transitive,2.3333333333333335
../Dialouge Corpus Filttered/parse_gold_filttered\Phase2\Phase2_gold\hi_2148_gold.conllu,193,वो पैसा दे रहे हैं [incomprehensible] मित्सुबिशी वाले ।,9,SOV,Transitive,1.7142857142857142
../Dialouge Corpus Filttered/parse_gold_filttered\Phase2\Phase2_gold\hi_2148_gold.conllu,197,दे रहे होते तो मैं तुझे भी 2 डॉलर का खिलाता ।,13,S-IO-O-V,Ditransitive,3.3636363636363638
../Dialouge Corpus Filttered/parse_gold_filttered\Phase2\Phase2_gold\hi_2148_gold.conllu,199,मुझे दे रहे होते तो मैं तुझे भी 2 डॉलर का खिला देता ।,14,S-IO-O-V,Ditransitive,3.1666666666666665
../Dialouge Corpus Filttered/parse_gold_filttered\Phase2\Phase2_gold\hi_2148_gold.conllu,212,तू क्या कर रहा है ।,6,SOV,Transitive,1.5
../Dialouge Corpus Filttered/parse_gold_filttered\Phase2\Phase2_gold\hi_2148_gold.conllu,257,ऐंड उस को लेज़र लाइट से जला देते हैं ।,11,OSV,Transitive,2.111111111111111
../Dialouge Corpus Filttered/parse_gold_filttered\Phase2\Phase2_gold\hi_2148_gold.conllu,289,और उस को जला के जैसे माइंज़ में काम करते हैं ना ।,15,SOV,Transitive,3.3076923076923075
../Dialouge Corpus Filttered/parse_gold_filttered\Phase2\Phase2_gold\hi_2148_gold.conllu,290,वैसे बैठ के मैं ने वो बाकी सेटअप कर दिया ।,11,SOV,Transitive,2.4444444444444446
../Dialouge Corpus Filttered/parse_gold_filttered\Phase2\Phase2_gold\hi_2148_gold.conllu,297,वो उस को लैब दिखा रहा था ।,8,S-IO-O-V,Ditransitive,2.0
../Dialouge Corpus Filttered/parse_gold_filttered\Phase2\Phase2_gold\hi_2148_gold.conllu,316,ये फ़िर भी काम कर रहा है ।,8,SOV,Transitive,2.0
../Dialouge Corpus Filttered/parse_gold_filttered\Phase2\Phase2_gold\hi_2148_gold.conllu,317,वो 1 फंडा दिया यार ।,6,SOV,Transitive,1.5
../Dialouge Corpus Filttered/parse_gold_filttered\Phase2\Phase2_gold\hi_2148_gold.conllu,364,तू छुट्टियों में बॉस्टन आ रहा है क्या ।,9,SOV,Transitive,2.142857142857143
../Dialouge Corpus Filttered/parse_gold_filttered\Phase2\Phase2_gold\hi_2148_gold.conllu,370,मैं अभी तक काम शुरू नहीं किया ।,8,SOV,Transitive,3.0
../Dialouge Corpus Filttered/parse_gold_filttered\Phase2\Phase2_gold\hi_2148_gold.conllu,402,ओह यार वो सब कुछ हम जो किए थे स्कूल वगैरह में आर्बिट है ।,16,SOV,Transitive,2.7142857142857144
../Dialouge Corpus Filttered/parse_gold_filttered\Phase2\Phase2_gold\hi_2148_gold.conllu,422,मेरे को आज टेकहोम एग्ज़ैम मिला है ।,9,SOV,Transitive,2.2857142857142856
../Dialouge Corpus Filttered/parse_gold_filttered\Phase2\Phase2_gold\hi_2148_gold.conllu,456,तो मैं ने एस्कॉर्ट ट्राए किया ।,7,SOV,Transitive,2.6
../Dialouge Corpus Filttered/parse_gold_filttered\Phase2\Phase2_gold\hi_2148_gold.conllu,484,कहता है मैं ने ऐश्वर्या राए को देखना चाहा तो उस में भारत का झंडा लगा ।,17,SOV,Transitive,3.4
../Dialouge Corpus Filttered/parse_gold_filttered\Phase2\Phase2_gold\hi_2148_gold.conllu,496,ऊपर से वो भी 10 डॉलर भेजने वाले ।,9,SOV,Transitive,2.142857142857143
../Dialouge Corpus Filttered/parse_gold_filttered\Phase2\Phase2_gold\hi_2148_gold.conllu,498,ऊपर से वो भी 10 डॉलर भेजने वाले हैं ।,10,SOV,Transitive,2.125
../Dialouge Corpus Filttered/parse_gold_filttered\Phase2\Phase2_gold\hi_2148_gold.conllu,511,मैं ये आज क्या फ़िर से रेजिस्टर करूँ ।,9,SOV,Transitive,3.857142857142857
../Dialouge Corpus Filttered/parse_gold_filttered\Phase2\Phase2_gold\hi_2148_gold.conllu,519,मैं उस को ईमेल भेजा वो फॉर्म टाइप था ना ।,11,S-IO-O-V,Ditransitive,2.0
../Dialouge Corpus Filttered/parse_gold_filttered\Phase2\Phase2_gold\hi_2148_gold.conllu,550,तू ने वो चेक कैश नहीं करा अभी तक ।,10,SOV,Transitive,2.0
../Dialouge Corpus Filttered/parse_gold_filttered\Phase2\Phase2_gold\hi_2148_gold.conllu,611,300 मैं बचाता हूँ ।,5,OSV,Transitive,1.3333333333333333
../Dialouge Corpus Filttered/parse_gold_filttered\Phase2\Phase2_gold\hi_2148_gold.conllu,619,तो 50 तो 50 होता है यार ।,8,SOV,Transitive,2.0
../Dialouge Corpus Filttered/parse_gold_filttered\Phase2\Phase2_gold\hi_2148_gold.conllu,632,तो मैं भी 200 ही बचाता हूँ ।,8,SOV,Transitive,2.3333333333333335
../Dialouge Corpus Filttered/parse_gold_filttered\Phase2\Phase2_gold\hi_2148_gold.conllu,636,तुझे मेरे जितना ही मिल रहा है तो तू क्यों रो रहा है ।,14,SOV,Transitive,2.1666666666666665
../Dialouge Corpus Filttered/parse_gold_filttered\Phase2\Phase2_gold\hi_2148_gold.conllu,637,अरे तेरे को ट्यूशन वेवर पूरा मिल रहा है यार ।,11,SOV,Transitive,2.4444444444444446
../Dialouge Corpus Filttered/parse_gold_filttered\Phase2\Phase2_gold\hi_2148_gold.conllu,638,मेरे को वो तो नहीं मिल रहा है पूरा ।,10,SOV,Transitive,2.125
../Dialouge Corpus Filttered/parse_gold_filttered\Phase2\Phase2_gold\hi_2148_gold.conllu,654,मुझे भी कल जा के सब कोर्सेज़ कन्फ़र्म करने पड़ेंगे ।,11,SOV,Transitive,2.3333333333333335
../Dialouge Corpus Filttered/parse_gold_filttered\Phase2\Phase2_gold\hi_2148_gold.conllu,661,यहाँ पर ये लोग को 1 कोर्स फ्लूइड में लेने का ही लेना है ।,15,SOV,Transitive,3.1538461538461537
../Dialouge Corpus Filttered/parse_gold_filttered\Phase2\Phase2_gold\hi_2148_gold.conllu,676,वो तो हाइड्रोफ़ोबिया होता है ।,6,SOV,Transitive,1.5
../Dialouge Corpus Filttered/parse_gold_filttered\Phase2\Phase2_gold\hi_2148_gold.conllu,682,मैं वो दबा दिया ।,5,SOV,Transitive,1.3333333333333333
../Dialouge Corpus Filttered/parse_gold_filttered\Phase2\Phase2_gold\hi_2148_gold.conllu,694,तेरे को वो जीआरई के टाइहै ना 1 बंदे ने मेरे को फ़ोबिआ का लिस्ट दिया था ।,19,S-IO-O-V,Ditransitive,2.588235294117647
../Dialouge Corpus Filttered/parse_gold_filttered\Phase2\Phase2_gold\hi_2148_gold.conllu,702,उसे जीआरईयोफ़ोबया हो गया होगा ।,6,SOV,Transitive,1.5
../Dialouge Corpus Filttered/parse_gold_filttered\Phase2\Phase2_gold\hi_2148_gold.conllu,705,ज्यादातर लड़कियों को यही रहता है ।,7,SOV,Transitive,1.4
../Dialouge Corpus Filttered/parse_gold_filttered\Phase2\Phase2_gold\hi_2148_gold.conllu,707,यहाँ पर 1 बंदे को जीआरई देना है अभी ।,10,SOV,Transitive,2.0
../Dialouge Corpus Filttered/parse_gold_filttered\Phase2\Phase2_gold\hi_2148_gold.conllu,720,लेकिन ये लोग कह रहा है कि अभी को जीआरई देने का है ।,15,SOV,Transitive,2.5384615384615383
../Dialouge Corpus Filttered/parse_gold_filttered\Phase2\Phase2_gold\hi_2148_gold.conllu,732,ओह मेरे को बाल कटवाने है यार ।,8,SOV,Transitive,2.0
../Dialouge Corpus Filttered/parse_gold_filttered\Phase2\Phase2_gold\hi_2148_gold.conllu,735,दूसरी बारी मैं 1 फ़्रेंड ने एक दूसरे के काट लिए ।,12,SOV,Transitive,2.5
../Dialouge Corpus Filttered/parse_gold_filttered\Phase2\Phase2_gold\hi_2148_gold.conllu,748,अभी तू 1 रबरबैंड डालेगा ना तो 1 वो पिगटेल बन जाता है ।,15,SOV,Transitive,2.4615384615384617
../Dialouge Corpus Filttered/parse_gold_filttered\Phase2\Phase2_gold\hi_2148_gold.conllu,751,लेकिन तू इतनी कंजूसी क्यों कर रहा है ।,9,SOV,Transitive,2.2857142857142856
../Dialouge Corpus Filttered/parse_gold_filttered\Phase2\Phase2_gold\hi_2148_gold.conllu,769,उस को मेरे को फ़ोन कर के बोलना है यार ।,11,OSV,Transitive,2.3333333333333335
../Dialouge Corpus Filttered/parse_gold_filttered\Phase2\Phase2_gold\hi_2148_gold.conllu,800,तू ऐसा मत बोल यार ।,6,SOV,Transitive,1.75
../Dialouge Corpus Filttered/parse_gold_filttered\Phase2\Phase2_gold\hi_2148_gold.conllu,825,यार मेरे को बहुत मुश्किल से सीट मिला है ।,10,SOV,Transitive,2.625
../Dialouge Corpus Filttered/parse_gold_filttered\Phase2\Phase2_gold\hi_2148_gold.conllu,836,वो मेरे को इंडिया ना भेज के अफ़ग़ानिस्तान भेज दिया तो मैं तो मर गया ।,16,SOV,Transitive,2.4285714285714284
../Dialouge Corpus Filttered/parse_gold_filttered\Phase2\Phase2_gold\hi_2148_gold.conllu,871,मैं ने 1 वे का क्यों पूछने का है यार ।,11,SOV,Transitive,2.111111111111111
../Dialouge Corpus Filttered/parse_gold_filttered\Phase2\Phase2_gold\hi_2148_gold.conllu,882,अभी ये लोग मेरे को 1350 दे रहा है ।,10,S-IO-O-V,Ditransitive,2.375
../Dialouge Corpus Filttered/parse_gold_filttered\Phase2\Phase2_gold\hi_2148_gold.conllu,900,तो मेरा गैंबलिंग तू फाइनेंस करेगा ।,7,OSV,Transitive,2.4
../Dialouge Corpus Filttered/parse_gold_filttered\Phase2\Phase2_gold\hi_2148_gold.conllu,905,ह्म मेरे को लड़की के घर जाना है ।,10,SOV,Transitive,2.5
../Dialouge Corpus Filttered/parse_gold_filttered\Phase2\Phase2_gold\hi_2148_gold.conllu,930,कोई ये रिकॉर्डिंग सुनने वाला होगा तब भी उस को सोचेगा की क्या बात कर रहे हैं ।,18,SOV,Transitive,2.1875
../Dialouge Corpus Filttered/parse_gold_filttered\Phase2\Phase2_gold\hi_2148_gold.conllu,959,बॉस्टन वाला तो सब को रिजेक्ट कर देगा ।,9,SOV,Transitive,2.142857142857143
../Dialouge Corpus Filttered/parse_gold_filttered\Phase2\Phase2_gold\hi_2148_gold.conllu,974,मैं ने सॉप वॉप सब चेंज किया हुआ है ।,10,SOV,Transitive,2.25
../Dialouge Corpus Filttered/parse_gold_filttered\Phase2\Phase2_gold\hi_2148_gold.conllu,987,तू पिएचडी शिफ़्ट करेगा क्या वहाँ से ।,8,SOV,Transitive,1.6666666666666667
../Dialouge Corpus Filttered/parse_gold_filttered\Phase2\Phase2_gold\hi_2148_gold.conllu,990,अगर मैं पिएचडी करूँगा तो वहाँ आ के फायदा नहीं बीयू में ।,13,SOV,Transitive,2.090909090909091
../Dialouge Corpus Filttered/parse_gold_filttered\Phase2\Phase2_gold\hi_2156_gold.conllu,7,तुम प्लेस बोलो तो हम बताएँ ।,7,SOV,Transitive,1.8
../Dialouge Corpus Filttered/parse_gold_filttered\Phase2\Phase2_gold\hi_2156_gold.conllu,9,[anonymized] तो ठीक ही था तुम ने जो लिखा था ।,11,SOV,Transitive,2.2222222222222223
../Dialouge Corpus Filttered/parse_gold_filttered\Phase2\Phase2_gold\hi_2156_gold.conllu,12,कुछ साला मोटर वोटर कुछ कर के होगा ।,9,SOV,Transitive,1.5714285714285714
../Dialouge Corpus Filttered/parse_gold_filttered\Phase2\Phase2_gold\hi_2156_gold.conllu,13,शिट एक बार हम ने ये बर्क्ली के लिए इन्फ़र्मेशन लिख के तो भेजी ।,15,SOV,Transitive,4.461538461538462
../Dialouge Corpus Filttered/parse_gold_filttered\Phase2\Phase2_gold\hi_2156_gold.conllu,75,अबे किताब का नाम अब कौन बता सकता है यार ।,11,OSV,Transitive,2.3333333333333335
../Dialouge Corpus Filttered/parse_gold_filttered\Phase2\Phase2_gold\hi_2156_gold.conllu,86,लेकिन उस के साथ कोई ऐसा भी नाम लिखो जो किसी ने सुना हो बेसिकली ।,16,OSV,Transitive,2.7857142857142856
../Dialouge Corpus Filttered/parse_gold_filttered\Phase2\Phase2_gold\hi_2156_gold.conllu,119,वो बत्ती 200 में कोई नहीं पढ़ा सकता है ।,10,OSV,Transitive,2.25
../Dialouge Corpus Filttered/parse_gold_filttered\Phase2\Phase2_gold\hi_2156_gold.conllu,128,[anonymized] ने सीएमयू में एमबीए छाप दिया यार ।,9,SOV,Transitive,2.0
../Dialouge Corpus Filttered/parse_gold_filttered\Phase2\Phase2_gold\hi_2156_gold.conllu,143,अबे हमारी हिंदी किसी को समझ में तो आएगी नहीं यार ।,12,OSV,Transitive,3.0
../Dialouge Corpus Filttered/parse_gold_filttered\Phase2\Phase2_gold\hi_2156_gold.conllu,196,तुम्हें वो याद है ।,5,SOV,Transitive,2.0
../Dialouge Corpus Filttered/parse_gold_filttered\Phase2\Phase2_gold\hi_2156_gold.conllu,203,1 तो [anonymized] ने लिया था ।,7,OSV,Transitive,1.8
../Dialouge Corpus Filttered/parse_gold_filttered\Phase2\Phase2_gold\hi_2156_gold.conllu,211,तुम को बहुत नाम याद है यार ।,8,SOV,Transitive,1.8333333333333333
../Dialouge Corpus Filttered/parse_gold_filttered\Phase2\Phase2_gold\hi_2156_gold.conllu,216,एक्चुअली फ़िट्सजेराल्ड और 1 देसी बंदे ने जो लिखी थी ना ।,12,SOV,Transitive,3.4
../Dialouge Corpus Filttered/parse_gold_filttered\Phase2\Phase2_gold\hi_2156_gold.conllu,217,ये [anonymized] के देसी बंदे कौन हैं साले वो जो किताब लिखते रहते हैं ।,15,SOV,Transitive,2.076923076923077
../Dialouge Corpus Filttered/parse_gold_filttered\Phase2\Phase2_gold\hi_2156_gold.conllu,223,लेकिन तुम फ़िट्सजेराल्ड लिख दो और [anonymized] ।,8,SOV,Transitive,1.8333333333333333
../Dialouge Corpus Filttered/parse_gold_filttered\Phase2\Phase2_gold\hi_2156_gold.conllu,240,जो [anonymized] ने पढ़ाई थी ।,6,OSV,Transitive,1.75
../Dialouge Corpus Filttered/parse_gold_filttered\Phase2\Phase2_gold\hi_2156_gold.conllu,298,इन लोग को 1 मिनट शटल बुलानी है ।,9,SOV,Transitive,1.7142857142857142
../Dialouge Corpus Filttered/parse_gold_filttered\Phase2\Phase2_gold\hi_2156_gold.conllu,311,इस में [incomprehensible] कॉल वेटिंग दे रखी हो तो उस को काट के तुम दूसरी कॉल कर सकते हो ।,20,OSV,Transitive,3.0
../Dialouge Corpus Filttered/parse_gold_filttered\Phase2\Phase2_gold\hi_2156_gold.conllu,345,वो मतलब मुझे याद नहीं है ।,7,OSV,Transitive,3.0
../Dialouge Corpus Filttered/parse_gold_filttered\Phase2\Phase2_gold\hi_2156_gold.conllu,378,331 [anonymized] ने लिया था ।,6,OSV,Transitive,1.75
../Dialouge Corpus Filttered/parse_gold_filttered\Phase2\Phase2_gold\hi_2156_gold.conllu,380,वो [anonymized] ने लिया था ।,6,OSV,Transitive,1.75
../Dialouge Corpus Filttered/parse_gold_filttered\Phase2\Phase2_gold\hi_2156_gold.conllu,381,तो फ़िर 330 किस ने लिया था ।,8,OSV,Transitive,2.6666666666666665
../Dialouge Corpus Filttered/parse_gold_filttered\Phase2\Phase2_gold\hi_2156_gold.conllu,387,अच्छा पहले तुम बाकी बताओ फ़िर देखते हैं इस को ।,11,SOV,Transitive,2.111111111111111
../Dialouge Corpus Filttered/parse_gold_filttered\Phase2\Phase2_gold\hi_2156_gold.conllu,401,सही तुम एमआइटी चले जाओगे तो बकचोदी हो जाएगी ।,10,SOV,Transitive,2.375
../Dialouge Corpus Filttered/parse_gold_filttered\Phase2\Phase2_gold\hi_2156_gold.conllu,419,उस ने सारे सब अपने नोट्स ही पढ़ाए थे यार ।,11,SOV,Transitive,2.2222222222222223
../Dialouge Corpus Filttered/parse_gold_filttered\Phase2\Phase2_gold\hi_2156_gold.conllu,430,उस ने यार 50 सवाल दिए थे 1 लिस्ट में ।,11,SOV,Transitive,1.8888888888888888
../Dialouge Corpus Filttered/parse_gold_filttered\Phase2\Phase2_gold\hi_2156_gold.conllu,512,डीएसपी तू ने लिया ही होगा मेरे ख्याल से ।,10,OSV,Transitive,1.875
../Dialouge Corpus Filttered/parse_gold_filttered\Phase2\Phase2_gold\hi_2156_gold.conllu,530,और ट्रान्सड्यूसर्स तुम ने लिया नहीं था खैर ।,9,OSV,Transitive,2.2857142857142856
../Dialouge Corpus Filttered/parse_gold_filttered\Phase2\Phase2_gold\hi_2156_gold.conllu,559,तुम ने आईपी लिया था क्या ।,7,SOV,Transitive,1.6
../Dialouge Corpus Filttered/parse_gold_filttered\Phase2\Phase2_gold\hi_2156_gold.conllu,566,एक्चुअली यहाँ पे जनता जो आईपी कर रही है हम उन्हें कभी भी नाम बताने की कोशिश करते हैं वहीं फ़ट जाती है ।,24,SOV,Transitive,2.409090909090909
../Dialouge Corpus Filttered/parse_gold_filttered\Phase2\Phase2_gold\hi_2156_gold.conllu,587,वो तो उस ने मैन्युअल से पढ़ाया था ।,9,OSV,Transitive,2.2857142857142856
../Dialouge Corpus Filttered/parse_gold_filttered\Phase2\Phase2_gold\hi_2156_gold.conllu,589,वो बेसिकली उस ने मैन्युअल से ही पढ़ा दिया उठा के एकदम ।,13,OSV,Transitive,3.0
../Dialouge Corpus Filttered/parse_gold_filttered\Phase2\Phase2_gold\hi_2156_gold.conllu,596,[incomprehensible] तो हम ने लिया ही नहीं था ।,9,OSV,Transitive,2.0
../Dialouge Corpus Filttered/parse_gold_filttered\Phase2\Phase2_gold\hi_2156_gold.conllu,630,[anonymized] ने 1 किताब पढ़ाई थी ना ।,8,SOV,Transitive,1.6666666666666667
../Dialouge Corpus Filttered/parse_gold_filttered\Phase2\Phase2_gold\hi_2156_gold.conllu,671,ये मेरे पास जिन्दगी में जो मैं ने पहली किताब खरीदी होगी वो थी ।,15,SOV,Transitive,3.6923076923076925
../Dialouge Corpus Filttered/parse_gold_filttered\Phase2\Phase2_gold\hi_2156_gold.conllu,725,स्टीवेन्स तुम्हें अच्छे से याद है यार ।,8,OSV,Transitive,2.5
../Dialouge Corpus Filttered/parse_gold_filttered\Phase2\Phase2_gold\hi_2156_gold.conllu,742,साला आईआईटी की कोर्स लिस्ट सब को पता होगी यार ।,11,OSV,Transitive,2.5555555555555554
../Dialouge Corpus Filttered/parse_gold_filttered\Phase2\Phase2_gold\hi_2156_gold.conllu,748,जनता आईआईटी जाती है ।,5,SOV,Transitive,1.3333333333333333
