File,Sent_ID,Sentence,Length,Word Order,Category,dependency length../Dialouge Corpus Filttered/parse_gold_filttered\Phase2\Phase2_gold\hi_4360_gold.conllu,790,आपा मैं सोच रहा हूँ बस कोई लड़की जो खाना वाना पकाती हो ना बस उस से दोस्ती कर लूँ और उस को कहूँ बस तू आ जा भई ।,30,SOV,Transitive,2.7142857142857144
../Dialouge Corpus Filttered/parse_gold_filttered\Phase2\Phase2_gold\hi_4360_gold.conllu,796,तुम तो सिम्पल स्पेगेटी बॉइल्ड की और उस के अंदर स्पेगेटी सॉज़ डाल दी ।,15,SOV,Transitive,2.769230769230769
../Dialouge Corpus Filttered/parse_gold_filttered\Phase2\Phase2_gold\hi_4360_gold.conllu,799,मैं तो यही करता हूँ ।,6,SOV,Transitive,1.5
../Dialouge Corpus Filttered/parse_gold_filttered\Phase2\Phase2_gold\hi_4360_gold.conllu,801,मैं तो मीटबॉल्ज़ डालती हूँ ।,6,SOV,Transitive,1.5
../Dialouge Corpus Filttered/parse_gold_filttered\Phase2\Phase2_gold\hi_4360_gold.conllu,807,लेकिन आपा दही तो मुझे लस्सी याद आ रही है अब ।,12,SOV,Transitive,3.1
../Dialouge Corpus Filttered/parse_gold_filttered\Phase2\Phase2_gold\hi_4360_gold.conllu,814,फ़िर हम वो सब कुछ करेंगे जो हम किया करते थे ।,12,SOV,Transitive,2.3
../Dialouge Corpus Filttered/parse_gold_filttered\Phase2\Phase2_gold\hi_4360_gold.conllu,814,फ़िर हम वो सब कुछ करेंगे जो हम किया करते थे ।,12,OSV,Transitive,2.3
../Dialouge Corpus Filttered/parse_gold_filttered\Phase2\Phase2_gold\hi_4360_gold.conllu,841,अज़गर मैं हाँफना शुरू कर दूँगी ।,7,SOV,Transitive,2.2
../Dialouge Corpus Filttered/parse_gold_filttered\Phase2\Phase2_gold\hi_4360_gold.conllu,843,अब तो मैं वो फद्दा हो गई हूँ ।,9,SOV,Transitive,2.0
../Dialouge Corpus Filttered/parse_gold_filttered\Phase2\Phase2_gold\hi_4360_gold.conllu,882,गुड्डी और छम्मो को तो हम ने इस तरह वो कोने में बैठाया था ।,15,OSV,Transitive,3.076923076923077
../Dialouge Corpus Filttered/parse_gold_filttered\Phase2\Phase2_gold\hi_4360_gold.conllu,886,हम ने टेकनीक आज़माई थी ना ।,7,SOV,Transitive,1.6
../Dialouge Corpus Filttered/parse_gold_filttered\Phase2\Phase2_gold\hi_4360_gold.conllu,896,वो अपने आप को कितना स्मार्ट समझता है ।,10,S-IO-O-V,Ditransitive,2.75
../Dialouge Corpus Filttered/parse_gold_filttered\Phase2\Phase2_gold\hi_4360_gold.conllu,909,शराफ़त हमे मार जाती ।,5,SOV,Transitive,1.3333333333333333
../Dialouge Corpus Filttered/parse_gold_filttered\Phase2\Phase2_gold\hi_4360_gold.conllu,916,1 तो लड़की से मैं ने भी बात की थी ।,11,OSV,Transitive,2.111111111111111
../Dialouge Corpus Filttered/parse_gold_filttered\Phase2\Phase2_gold\hi_4360_gold.conllu,934,मैं ने कहा बस बिलकुल सही तुम्हें जो भी गुग्गन आपा कह रही है सही कह रही है ।,19,IO-O-S-V,Ditransitive,2.588235294117647
../Dialouge Corpus Filttered/parse_gold_filttered\Phase2\Phase2_gold\hi_4360_gold.conllu,945,नहीं अब तो वो हैदराबाद चला गया ना ।,9,SOV,Transitive,2.2857142857142856
../Dialouge Corpus Filttered/parse_gold_filttered\Phase2\Phase2_gold\hi_4360_gold.conllu,960,आप 15 दिन वहाँ पे काम करें हाज़री लगाएँ ।,10,SOV,Transitive,2.375
../Dialouge Corpus Filttered/parse_gold_filttered\Phase2\Phase2_gold\hi_4360_gold.conllu,972,अरे ये जो सारे हंगामे शंगामे हो रहे हैं ना सब को कामों में इतनी वो लगी हुई हो कि मतलब फ़िर वो वाली बात ही ना हो ।,29,SOV,Transitive,3.6666666666666665
../Dialouge Corpus Filttered/parse_gold_filttered\Phase2\Phase2_gold\hi_4360_gold.conllu,983,2 दिन अगर तुम छुट्टी कर रहे हो तो तीसरे दिन डॉक्टर की अपॉइंटमेंट ।,15,SOV,Transitive,2.3846153846153846
../Dialouge Corpus Filttered/parse_gold_filttered\Phase2\Phase2_gold\hi_4360_gold.conllu,997,दूसरी गवर्नमेंट जो आएगी वो अपने बंदे लगा देगी और दूसरों के बंदे हटा देंगे ।,16,SOV,Transitive,1.8571428571428572
../Dialouge Corpus Filttered/parse_gold_filttered\Phase2\Phase2_gold\hi_4360_gold.conllu,1005,अब तो गुग्गन आपा मुझे वो मिल रहा है ना अभी 3 महीने के अंदर जो है ना पासपोर्ट मिल जाएगा ।,22,SOV,Transitive,2.8
../Dialouge Corpus Filttered/parse_gold_filttered\Phase2\Phase2_gold\hi_4360_gold.conllu,1053,वो भी तो मैं ने देखी है ।,8,OSV,Transitive,2.0
../Dialouge Corpus Filttered/parse_gold_filttered\Phase2\Phase2_gold\hi_4360_gold.conllu,1079,मैं ने बड़ी तारीफ़ें सुनी हैं ।,7,SOV,Transitive,1.6
../Dialouge Corpus Filttered/parse_gold_filttered\Phase2\Phase2_gold\hi_4360_gold.conllu,1107,लोग मुझे तारीफ़ कर रहे हैं और केविन कोस्टनर की मूवी मैं नहीं छोड़ती अज़गर ।,16,OSV,Transitive,2.642857142857143
../Dialouge Corpus Filttered/parse_gold_filttered\Phase2\Phase2_gold\hi_4360_gold.conllu,1111,केविन कोस्टनर की मूवी मैं कहती हूँ बस ।,9,OSV,Transitive,1.4285714285714286
../Dialouge Corpus Filttered/parse_gold_filttered\Phase2\Phase2_gold\hi_4360_gold.conllu,1114,तुम ने वो देखी है उस की केविन कोस्टनर की ।,11,SOV,Transitive,1.7777777777777777
../Dialouge Corpus Filttered/parse_gold_filttered\Phase2\Phase2_gold\hi_4360_gold.conllu,1119,हाँ वो उस की बीवी होती है वो उस के साथ केविन कोस्टनर के साथ फ़्री हो जाती हैं और वो बदला लेता है ।,25,SOV,Transitive,3.0434782608695654
../Dialouge Corpus Filttered/parse_gold_filttered\Phase2\Phase2_gold\hi_4360_gold.conllu,1119,हाँ वो उस की बीवी होती है वो उस के साथ केविन कोस्टनर के साथ फ़्री हो जाती हैं और वो बदला लेता है ।,25,SOV,Transitive,3.0434782608695654
../Dialouge Corpus Filttered/parse_gold_filttered\Phase2\Phase2_gold\hi_4360_gold.conllu,1124,ऐंथनी क्विन अपनी बीवी को पता नहीं मूहँ पे वो मार देता है और उस को वहाँ पे तवायफ़्फ़ो के जगह पे छोड़ आता है ।,26,SOV,Transitive,3.4583333333333335
../Dialouge Corpus Filttered/parse_gold_filttered\Phase2\Phase2_gold\hi_4649_gold.conllu,5,इन लोग को कुछ लैंग्वेज का मतलब सैम्पल चहिए ।,10,SOV,Transitive,2.0
../Dialouge Corpus Filttered/parse_gold_filttered\Phase2\Phase2_gold\hi_4649_gold.conllu,16,तो तुम को हम इस का इन्फ़र्मेशन फ़ॉर्वड कर देंगे ।,11,IO-S-O-V,Ditransitive,3.111111111111111
../Dialouge Corpus Filttered/parse_gold_filttered\Phase2\Phase2_gold\hi_4649_gold.conllu,26,जितना चाहे उतना करेगा ।,6,SOV,Transitive,1.75
../Dialouge Corpus Filttered/parse_gold_filttered\Phase2\Phase2_gold\hi_4649_gold.conllu,47,तो एक्चुअली हम इसी को यूज़ कर रहे थे ।,10,SOV,Transitive,2.875
../Dialouge Corpus Filttered/parse_gold_filttered\Phase2\Phase2_gold\hi_4649_gold.conllu,75,तुम जीमैट की तैयारी करो ।,6,SOV,Transitive,2.0
../Dialouge Corpus Filttered/parse_gold_filttered\Phase2\Phase2_gold\hi_4649_gold.conllu,77,वो ही हम बोल थे उस को ।,8,O-S-IO-V,Ditransitive,1.5
../Dialouge Corpus Filttered/parse_gold_filttered\Phase2\Phase2_gold\hi_4649_gold.conllu,104,वो ही मेरे को भी यार मतलब थोड़ा ये लगा कि कैसे उस की मेल आई ।,17,SOV,Transitive,3.3333333333333335
../Dialouge Corpus Filttered/parse_gold_filttered\Phase2\Phase2_gold\hi_4649_gold.conllu,143,बट मतलब तो उस को एडमिशन तो मेरे ख्याल से मिल जाएगा ।,13,SOV,Transitive,4.181818181818182
../Dialouge Corpus Filttered/parse_gold_filttered\Phase2\Phase2_gold\hi_4649_gold.conllu,190,वो मैं उस को कॉलेज से ही फ़ोन कर दिया ।,11,SOV,Transitive,3.4444444444444446
../Dialouge Corpus Filttered/parse_gold_filttered\Phase2\Phase2_gold\hi_4649_gold.conllu,228,अनु के लिए तो हम ट्राए कर रहे हैं कि इस को जॉब मिल जाए या कुछ ।,18,SOV,Transitive,2.4375
../Dialouge Corpus Filttered/parse_gold_filttered\Phase2\Phase2_gold\hi_4649_gold.conllu,239,मेरे को 1 फ़्रेंड ने कहा कि तुम इधर उधर जॉब देख रहे हो ।,15,SOV,Transitive,2.4615384615384617
../Dialouge Corpus Filttered/parse_gold_filttered\Phase2\Phase2_gold\hi_4649_gold.conllu,249,अजय कुछ नहीं कर रहा है ।,7,SOV,Transitive,1.8
../Dialouge Corpus Filttered/parse_gold_filttered\Phase2\Phase2_gold\hi_4649_gold.conllu,255,विरेन से बात वात हुई क्या कभी ।,8,OSV,Transitive,1.8333333333333333
../Dialouge Corpus Filttered/parse_gold_filttered\Phase2\Phase2_gold\hi_4649_gold.conllu,299,मैं ने कहा मैं उस पे काम किया हुआ हूँ ।,12,SOV,Transitive,2.6
../Dialouge Corpus Filttered/parse_gold_filttered\Phase2\Phase2_gold\hi_4649_gold.conllu,305,लोटस पे भी मैं ने पूरा काम किया हुआ है ।,11,SOV,Transitive,2.2222222222222223
../Dialouge Corpus Filttered/parse_gold_filttered\Phase2\Phase2_gold\hi_4649_gold.conllu,325,वो स्पेशलाइज़्ड तो हो जाता है ।,7,SOV,Transitive,1.8
../Dialouge Corpus Filttered/parse_gold_filttered\Phase2\Phase2_gold\hi_4649_gold.conllu,351,उस से मतलब मैरिड लाइफ़ भी अफेक्टेड होती है ।,10,SOV,Transitive,2.5
../Dialouge Corpus Filttered/parse_gold_filttered\Phase2\Phase2_gold\hi_4649_gold.conllu,380,तो भैया का उस का बर्थडे वर्थडे था तो उस के लिए पापा लोग मतलब क्लीनिक व्लीनिक बना के उस को एकदम बर्थडे के दिन रेडी करा के उस को दिए हैं ।,33,SOV,Transitive,3.967741935483871
../Dialouge Corpus Filttered/parse_gold_filttered\Phase2\Phase2_gold\hi_4649_gold.conllu,385,तुम्हारे पापा अभी क्या कर रहे हैं ।,8,SOV,Transitive,1.6666666666666667
../Dialouge Corpus Filttered/parse_gold_filttered\Phase2\Phase2_gold\hi_4649_gold.conllu,389,इतना बैकवर्ड वुकवर्ड वाला इतना ये हो गया ।,9,SOV,Transitive,1.7142857142857142
../Dialouge Corpus Filttered/parse_gold_filttered\Phase2\Phase2_gold\hi_4649_gold.conllu,392,उन का बस प्रोमोशन अभी भी मतलब लटका ही हुआ है ।,12,SOV,Transitive,2.0
../Dialouge Corpus Filttered/parse_gold_filttered\Phase2\Phase2_gold\hi_4649_gold.conllu,404,मतलब बहुत दिनो में मतलब वो इतने अच्छे से बात वात कर रहा ।,14,SOV,Transitive,3.75
../Dialouge Corpus Filttered/parse_gold_filttered\Phase2\Phase2_gold\hi_4649_gold.conllu,424,अंकल पहुँचे हैं तो मतलब अंकल अपना कुछ बताए वुताए होंगे ।,12,SOV,Transitive,2.6
../Dialouge Corpus Filttered/parse_gold_filttered\Phase2\Phase2_gold\hi_4649_gold.conllu,426,4 500 डॉलर तुम लोग खर्च कर दिए ।,9,OSV,Transitive,1.5714285714285714
../Dialouge Corpus Filttered/parse_gold_filttered\Phase2\Phase2_gold\hi_4649_gold.conllu,480,तो अनू कह रही है कि ठीक है वो भी यही ले लेगी ।,14,SOV,Transitive,1.9166666666666667
../Dialouge Corpus Filttered/parse_gold_filttered\Phase2\Phase2_gold\hi_4649_gold.conllu,482,वो फाइनेंस का 1 ले रही है ।,8,SOV,Transitive,1.8333333333333333
../Dialouge Corpus Filttered/parse_gold_filttered\Phase2\Phase2_gold\hi_4649_gold.conllu,523,मैं यूज़ कर रहा हूँ ।,7,OSV,Transitive,1.8
../Dialouge Corpus Filttered/parse_gold_filttered\Phase2\Phase2_gold\hi_4649_gold.conllu,570,तो उस में हम तुम को 2 बुलेटिन बोर्ड का नाम भेज देंगे ।,14,S-IO-O-V,Ditransitive,3.8333333333333335
../Dialouge Corpus Filttered/parse_gold_filttered\Phase2\Phase2_gold\hi_4649_gold.conllu,589,तो हम तो उसी को यूज़ करते हैं लेकिन संदीप बता रहा था कि वो यूज़ करता है ।,19,SOV,Transitive,2.411764705882353
../Dialouge Corpus Filttered/parse_gold_filttered\Phase2\Phase2_gold\hi_4649_gold.conllu,593,क्योंकि मेरा नेट्स्केप के थ्रू मैं नहीं करता ।,9,OSV,Transitive,3.4285714285714284
../Dialouge Corpus Filttered/parse_gold_filttered\Phase2\Phase2_gold\hi_4649_gold.conllu,678,और कोई मुझे बता रहा था कि अगर लूइविल जा के ले लो तो सिर्फ़ दिखाना उसे अपना इंडियन लाइसेंस और फ़िर वो यहाँ का लाइसेंस दे देते हैं ।,30,SOV,Transitive,3.3214285714285716
../Dialouge Corpus Filttered/parse_gold_filttered\Phase2\Phase2_gold\hi_4649_gold.conllu,735,क्योंकि इंडियाना में जो मौसी जी के बच्चे हैं उन्होंने टेस्ट दिया ।,13,SOV,Transitive,2.8181818181818183
../Dialouge Corpus Filttered/parse_gold_filttered\Phase2\Phase2_gold\hi_4649_gold.conllu,749,जब कि मैं इंडिया में मतलब 6 7 साल से तो गाड़ी चला रहा था ।,16,SOV,Transitive,3.7857142857142856
../Dialouge Corpus Filttered/parse_gold_filttered\Phase2\Phase2_gold\hi_4649_gold.conllu,785,तो बोले तुम भी पीएचडी करो ।,7,SOV,Transitive,2.0
../Dialouge Corpus Filttered/parse_gold_filttered\Phase2\Phase2_gold\hi_4649_gold.conllu,855,वो सब करती है ।,5,SOV,Transitive,1.3333333333333333
../Dialouge Corpus Filttered/parse_gold_filttered\Phase2\Phase2_gold\hi_4770_gold.conllu,15,तो तुम ने उस को बोल दिया हाँ ।,9,SOV,Transitive,2.2857142857142856
../Dialouge Corpus Filttered/parse_gold_filttered\Phase2\Phase2_gold\hi_4770_gold.conllu,25,हाँ तो वो मैं जानता हूँ ।,7,OSV,Transitive,2.2
../Dialouge Corpus Filttered/parse_gold_filttered\Phase2\Phase2_gold\hi_4770_gold.conllu,39,वो खाना बना रही है ना तो उस की स्मेल ।,11,SOV,Transitive,2.4444444444444446
../Dialouge Corpus Filttered/parse_gold_filttered\Phase2\Phase2_gold\hi_4770_gold.conllu,52,लेकिन मैं उस को 1 और आदमी से कन्फ़र्म करना चाहता था ।,13,SOV,Transitive,3.3636363636363638
../Dialouge Corpus Filttered/parse_gold_filttered\Phase2\Phase2_gold\hi_4770_gold.conllu,67,अगस्टा तुम्हें दिखेगा भी जगह जगह पे ।,8,OSV,Transitive,1.5
../Dialouge Corpus Filttered/parse_gold_filttered\Phase2\Phase2_gold\hi_4770_gold.conllu,83,अब तुम्हें ये करना है जब तुम्हें दिखने लगे कि अगस्टा आने वाला है ।,15,SOV,Transitive,1.9230769230769231
../Dialouge Corpus Filttered/parse_gold_filttered\Phase2\Phase2_gold\hi_4770_gold.conllu,85,तो मैं ने बताया कि यहाँ तुम्हें बहुत बड़े बड़े बोर्ड नहीं मिलेंगे जिस से तुम्हें ये लगे कि अगस्टा आ गया ।,23,SOV,Transitive,3.142857142857143
../Dialouge Corpus Filttered/parse_gold_filttered\Phase2\Phase2_gold\hi_4770_gold.conllu,91,तो अब तुम ये करोगे के वॉशिंगटन रोड की एग्ज़िट नम्बर 65 है ।,14,SOV,Transitive,2.5
../Dialouge Corpus Filttered/parse_gold_filttered\Phase2\Phase2_gold\hi_4770_gold.conllu,93,ये तुम ने अच्छा बताया ।,6,OSV,Transitive,2.25
../Dialouge Corpus Filttered/parse_gold_filttered\Phase2\Phase2_gold\hi_4770_gold.conllu,102,वॉशिंगटन रोड एग्ज़िट 65 जब तुम लोगे और एग्ज़िट जहाँ मतलब ख़तम होगी जिस रोड पे कनेक्ट होगी ।,19,OSV,Transitive,2.411764705882353
../Dialouge Corpus Filttered/parse_gold_filttered\Phase2\Phase2_gold\hi_4770_gold.conllu,107,मतलब जैसे ही हम मतलब एग्ज़िट ले कर के अंदर आएँगे ।,12,SOV,Transitive,4.2
../Dialouge Corpus Filttered/parse_gold_filttered\Phase2\Phase2_gold\hi_4770_gold.conllu,120,और तक़रीबन तुम्हें जो है 5 रेड लाइट्स क्रॉस करनी होंगी ।,12,SOV,Transitive,3.8
../Dialouge Corpus Filttered/parse_gold_filttered\Phase2\Phase2_gold\hi_4770_gold.conllu,132,तो अब मैं तुम्हें बताता हूँ जब तुम राइट टर्न ले के बढ़ोगे तो तुम्हें रोड जो दिखाई देंगी सामने उन पे तुम ध्यान रखना ।,26,SOV,Transitive,3.4583333333333335
../Dialouge Corpus Filttered/parse_gold_filttered\Phase2\Phase2_gold\hi_4770_gold.conllu,133,तुम्हें जैसे बोए सकॉट रोड दिखाई देगी ।,8,SOV,Transitive,1.6666666666666667
../Dialouge Corpus Filttered/parse_gold_filttered\Phase2\Phase2_gold\hi_4770_gold.conllu,150,ह्म उस के बाद तुम आगे बढ़ोगे तो तुम्हें बर्टमैन रोड दिखाई देगी ।,14,SOV,Transitive,2.6666666666666665
../Dialouge Corpus Filttered/parse_gold_filttered\Phase2\Phase2_gold\hi_4770_gold.conllu,166,फिर और आगे बढ़ोगे तो तुम्हें 1 रेड लाइट दिखाई देगी बर्कमैन रोड ।,14,SOV,Transitive,2.4166666666666665
../Dialouge Corpus Filttered/parse_gold_filttered\Phase2\Phase2_gold\hi_4770_gold.conllu,192,उस के बाद जो अनदर रेड लाइट तुम्हें दिखाई देगी ।,11,OSV,Transitive,2.3333333333333335
../Dialouge Corpus Filttered/parse_gold_filttered\Phase2\Phase2_gold\hi_4770_gold.conllu,195,उस से पहले तुम्हें उलटे साइड पे फ़ूडलाइन कॉम्प्लेक्स दिखाई देगा ।,12,SOV,Transitive,2.7
../Dialouge Corpus Filttered/parse_gold_filttered\Phase2\Phase2_gold\hi_4770_gold.conllu,217,तो तुम ऐसा करना के 2 रेड लाइट्स क्रॉस करने के बाद तुम [incomprehensible] आ जाना ।,17,SOV,Transitive,2.7333333333333334
../Dialouge Corpus Filttered/parse_gold_filttered\Phase2\Phase2_gold\hi_4770_gold.conllu,249,तुम 2 रेड लाइट क्रॉस करने के बाद बर्कमैन के बाद सेंट्रल लेन में आ कर लेफ़्ट टर्न ले लेना ।,21,SOV,Transitive,3.3684210526315788
../Dialouge Corpus Filttered/parse_gold_filttered\Phase2\Phase2_gold\hi_4770_gold.conllu,267,ये जो फ़ूडलाइन जो तुम बोल रहे हो दिखेगी हमें लेफ़्ट साइड पे 2 रेड लाइट के क्रॉस करने के बाद तो यहीं से मतलब हमें जो है लेफ़्ट के लिए एग्ज़िट लेना है फ़ूडलाइन कॉम्प्लेक्स ।,37,SOV,Transitive,3.942857142857143
../Dialouge Corpus Filttered/parse_gold_filttered\Phase2\Phase2_gold\hi_4770_gold.conllu,272,एग्ज़िट वेग्ज़िट कुछ नहीं लेना तुम रेड लाइट क्रॉस की सेंट्रल लेन में आ गए ।,16,SOV,Transitive,2.5
../Dialouge Corpus Filttered/parse_gold_filttered\Phase2\Phase2_gold\hi_4770_gold.conllu,289,अरे तुम सेंट्रल लेन में आ कर सिर्फ़ लेफ़्ट टर्न ले सकते हो वहाँ से ।,16,SOV,Transitive,2.857142857142857
../Dialouge Corpus Filttered/parse_gold_filttered\Phase2\Phase2_gold\hi_4770_gold.conllu,290,क्योंकि राइट तो तुम अपनी राइट पे जा के ले लोगे ।,12,OSV,Transitive,3.2
../Dialouge Corpus Filttered/parse_gold_filttered\Phase2\Phase2_gold\hi_4770_gold.conllu,296,2 रेड लाइट ने क्रॉस की ।,8,OSV,Transitive,2.0
../Dialouge Corpus Filttered/parse_gold_filttered\Phase2\Phase2_gold\hi_4770_gold.conllu,302,अच्छा वो मतलब अगर हम रेड लाइट क्रॉस करेंगे तो रेड लाइट क्रॉस करने में जो रोड सीधी जा रही है डाउनटाउन के लिए तुम कह रहे हो ।,29,OSV,Transitive,3.7037037037037037
../Dialouge Corpus Filttered/parse_gold_filttered\Phase2\Phase2_gold\hi_4770_gold.conllu,311,नहीं मैं ये समझ रहा हूँ ना सेंट्रल लेन का मतलब ये होता है ।,15,SOV,Transitive,2.3076923076923075
../Dialouge Corpus Filttered/parse_gold_filttered\Phase2\Phase2_gold\hi_4770_gold.conllu,317,तेरे को वो सब समझ नहीं आएगा ।,8,SOV,Transitive,1.6666666666666667
../Dialouge Corpus Filttered/parse_gold_filttered\Phase2\Phase2_gold\hi_4770_gold.conllu,331,जो मतलब हमें लेफ़्ट में मोड़ेंगे ।,7,SOV,Transitive,3.0
../Dialouge Corpus Filttered/parse_gold_filttered\Phase2\Phase2_gold\hi_4770_gold.conllu,336,तुम को लेफ़्ट टर्न लेना है तो लेफ़्ट पे तो पूरी लेन है ना ।,15,SOV,Transitive,2.3846153846153846
../Dialouge Corpus Filttered/parse_gold_filttered\Phase2\Phase2_gold\hi_4770_gold.conllu,340,तो हम लेफ़्ट ही लें मतलब ।,7,SOV,Transitive,2.2
../Dialouge Corpus Filttered/parse_gold_filttered\Phase2\Phase2_gold\hi_4770_gold.conllu,342,तुम्हें तो मैं ने बोला कि तुम 1 रेड लाइट क्रॉस करो ।,13,SOV,Transitive,2.909090909090909
../Dialouge Corpus Filttered/parse_gold_filttered\Phase2\Phase2_gold\hi_4770_gold.conllu,351,तो तुम को ओक पार्क अपार्टमेंट जो है वो ज़्यादा दिखाई देगा [incomprehensible] ।,14,SOV,Transitive,2.8333333333333335
../Dialouge Corpus Filttered/parse_gold_filttered\Phase2\Phase2_gold\hi_4770_gold.conllu,362,और अगर तुम्हें लेन भी लिखनी है तो लेन भी लिख लो वुड्ज़ एज ।,15,SOV,Transitive,2.4615384615384617
