File,Sent_ID,Sentence,Length,Word Order,Category,dependency length../Dialouge Corpus Filttered/parse_gold_filttered\Phase2\Phase2_gold\hi_6300_gold.conllu,366,वहाँ पे तो मेरे को जा के बोर्डिंग कार्ड और वो सब कुछ करनी है ।,16,SOV,Transitive,3.7857142857142856
../Dialouge Corpus Filttered/parse_gold_filttered\Phase2\Phase2_gold\hi_6300_gold.conllu,403,तो मैं तो इन के भी खा लेती हूँ बैठी बैठी आराम से ।,14,SOV,Transitive,2.3333333333333335
../Dialouge Corpus Filttered/parse_gold_filttered\Phase2\Phase2_gold\hi_6300_gold.conllu,444,हाँ और थोड़े चिप्स वगैरह जो छोटा वाला पैकेट होता है वो ।,13,SOV,Transitive,2.3636363636363638
../Dialouge Corpus Filttered/parse_gold_filttered\Phase2\Phase2_gold\hi_6300_gold.conllu,500,क्योंकि आंटी पता है मैं पैकिंग कर रहा था ।,10,SOV,Transitive,2.25
../Dialouge Corpus Filttered/parse_gold_filttered\Phase2\Phase2_gold\hi_6300_gold.conllu,513,अब तुम क्या करना 1 नया खरीद लेना आते वक्त ।,11,SOV,Transitive,1.8888888888888888
../Dialouge Corpus Filttered/parse_gold_filttered\Phase2\Phase2_gold\hi_6300_gold.conllu,526,नहीं वो तो ठीक है और मैं दूसरा ले आऊँगा ।,11,SOV,Transitive,2.111111111111111
../Dialouge Corpus Filttered/parse_gold_filttered\Phase2\Phase2_gold\hi_6300_gold.conllu,563,फ़िर मैं ने शावर ले के ।,7,SOV,Transitive,2.0
../Dialouge Corpus Filttered/parse_gold_filttered\Phase2\Phase2_gold\hi_6300_gold.conllu,574,फ़िर मैं ने उस को दवाई दी थी ।,9,S-IO-O-V,Ditransitive,2.5714285714285716
../Dialouge Corpus Filttered/parse_gold_filttered\Phase2\Phase2_gold\hi_6300_gold.conllu,643,हाँ मैं 2 को तो जानता भी था ।,9,SOV,Transitive,2.5714285714285716
../Dialouge Corpus Filttered/parse_gold_filttered\Phase2\Phase2_gold\hi_6300_gold.conllu,731,तो मेरे को तो इतनी सारी चीजें करनी थी ना आज ।,12,SOV,Transitive,2.6
../Dialouge Corpus Filttered/parse_gold_filttered\Phase2\Phase2_gold\hi_6300_gold.conllu,950,तो वो फ़िर हम ने टेप कर लिया ।,9,OSV,Transitive,3.0
../Dialouge Corpus Filttered/parse_gold_filttered\Phase2\Phase2_gold\hi_6300_gold.conllu,959,तो फ़िर वो भी हम ने टेप कर लिया है थोड़ा बहुत ।,13,OSV,Transitive,2.909090909090909
../Dialouge Corpus Filttered/parse_gold_filttered\Phase2\Phase2_gold\hi_6300_gold.conllu,1003,तेरे को क्या करना है अब ।,9,SOV,Transitive,2.142857142857143
../Dialouge Corpus Filttered/parse_gold_filttered\Phase2\Phase2_gold\hi_6300_gold.conllu,1012,क्योंकि मेरे को पता है वो गुजिया भी बड़ी अच्छी बनाती हैं ।,13,SOV,Transitive,2.4545454545454546
../Dialouge Corpus Filttered/parse_gold_filttered\Phase2\Phase2_gold\hi_6300_gold.conllu,1039,दादी जी आलू के पराँठे और वो सब कुछ चीज़ बहुत ही अच्छे बनाती हैं ।,16,SOV,Transitive,3.2857142857142856
../Dialouge Corpus Filttered/parse_gold_filttered\Phase2\Phase2_gold\hi_6300_gold.conllu,1052,हाँ मैं ने दादा जी दादी जी को 1 लैटर लिखी थी हिन्दी के अंदर ।,16,S-IO-O-V,Ditransitive,3.0714285714285716
../Dialouge Corpus Filttered/parse_gold_filttered\Phase2\Phase2_gold\hi_6300_gold.conllu,1055,तो फ़िर वो हिन्दी मैं लिखी थी 3 4 पेज की ।,12,OSV,Transitive,2.3
../Dialouge Corpus Filttered/parse_gold_filttered\Phase2\Phase2_gold\hi_6300_gold.conllu,1058,तो फ़िर वो दादी जी को इतनी अच्छी लगी कि डेली के अंदर उन्होंने सब को पढ़ाया और सब को दिखाया ।,22,OSV,Transitive,3.55
../Dialouge Corpus Filttered/parse_gold_filttered\Phase2\Phase2_gold\hi_6300_gold.conllu,1070,जब की तुम ने आइडिया दिया था ।,8,SOV,Transitive,2.0
../Dialouge Corpus Filttered/parse_gold_filttered\Phase2\Phase2_gold\hi_6300_gold.conllu,1084,तो फ़िर उन के तो आ रहा है और उन को मैं ने रिप्लाई भी कर दिया और ऐसे ।,20,OSV,Transitive,3.0555555555555554
../Dialouge Corpus Filttered/parse_gold_filttered\Phase2\Phase2_gold\hi_6300_gold.conllu,1086,शैलेश का भी ईमेल आ गया और उस को भी मैं ने रिप्लाई कर दिया और ऐसे ।,18,OSV,Transitive,2.6875
../Dialouge Corpus Filttered/parse_gold_filttered\Phase2\Phase2_gold\hi_6300_gold.conllu,1094,पर फ़िर तुम्हारे अंकल ये ही बोल रहे थे कि शायद है ना क्या है कि वहाँ से आजकल तेरे को पता है ना उस को कितनी दिक्कत होती है कॉल करनी बाहर ।,34,SOV,Transitive,2.75
../Dialouge Corpus Filttered/parse_gold_filttered\Phase2\Phase2_gold\hi_6300_gold.conllu,1094,पर फ़िर तुम्हारे अंकल ये ही बोल रहे थे कि शायद है ना क्या है कि वहाँ से आजकल तेरे को पता है ना उस को कितनी दिक्कत होती है कॉल करनी बाहर ।,34,SOV,Transitive,2.75
../Dialouge Corpus Filttered/parse_gold_filttered\Phase2\Phase2_gold\hi_6300_gold.conllu,1103,मैं इस बार उस से बात करूँगी तब मैं पूछूँगी ।,11,SOV,Transitive,2.4444444444444446
../Dialouge Corpus Filttered/parse_gold_filttered\Phase2\Phase2_gold\hi_6300_gold.conllu,1104,और शैलेश ने क्या लिखा तेरे को ।,8,S-O-IO-V,Ditransitive,1.8333333333333333
../Dialouge Corpus Filttered/parse_gold_filttered\Phase2\Phase2_gold\hi_6300_gold.conllu,1116,सब लोग हैट्स पहन के ऐसे हैं क्या ।,11,SOV,Transitive,1.7777777777777777
../Dialouge Corpus Filttered/parse_gold_filttered\Phase2\Phase2_gold\hi_6300_gold.conllu,1141,और फ़िर हम लोग 1 कार रेंट कर लेंगे ।,10,SOV,Transitive,2.875
../Dialouge Corpus Filttered/parse_gold_filttered\Phase2\Phase2_gold\hi_6300_gold.conllu,1165,ऑस्टिन वैसे मैं ने तो बिलकुल भी नहीं देखा है ।,11,OSV,Transitive,3.3333333333333335
../Dialouge Corpus Filttered/parse_gold_filttered\Phase2\Phase2_gold\hi_6300_gold.conllu,1172,क्योंकि मेरे को टाइम नहीं मिलता और जरूरत ही नहीं पड़ती बिलकुल भी ।,14,SOV,Transitive,2.5
../Dialouge Corpus Filttered/parse_gold_filttered\Phase2\Phase2_gold\hi_6300_gold.conllu,1180,नहीं तो अगर अगर ये हो क्या करूँ मैं क्या करूँ तो तुझे पता है ।,17,SOV,Transitive,2.533333333333333
../Dialouge Corpus Filttered/parse_gold_filttered\Phase2\Phase2_gold\hi_6300_gold.conllu,1195,हाँ तो नेक्स्ट सेमेस्टर में तो मैं ने 5 कोर्सेस लिए हैं ।,13,SOV,Transitive,3.4545454545454546
../Dialouge Corpus Filttered/parse_gold_filttered\Phase2\Phase2_gold\hi_6300_gold.conllu,1204,तो फ़िर इसलिए मैं वो किताब भी ले के जा रहा हूँ ताकि मैं 1 कोर्स का तो अर्ली फ़ाइनल कर के खत्म कर दूँगा ।,26,SOV,Transitive,3.9166666666666665
../Dialouge Corpus Filttered/parse_gold_filttered\Phase2\Phase2_gold\hi_6300_gold.conllu,1222,मुझे तो ये ही होता है कई बार कि लकिली तुम्हें अच्छी जगह में वो मिल गया एडमिशन ।,19,SOV,Transitive,3.0
../Dialouge Corpus Filttered/parse_gold_filttered\Phase2\Phase2_gold\hi_6300_gold.conllu,1226,मैं ने भी ज्यादा कुछ किया नहीं ।,8,SOV,Transitive,1.8333333333333333
../Dialouge Corpus Filttered/parse_gold_filttered\Phase2\Phase2_gold\hi_6400_gold.conllu,27,हम लोगों ने हीट चलाई ।,6,SOV,Transitive,1.5
../Dialouge Corpus Filttered/parse_gold_filttered\Phase2\Phase2_gold\hi_6400_gold.conllu,32,हम लोगों ने हीट बंद कर दी ।,8,SOV,Transitive,1.6666666666666667
../Dialouge Corpus Filttered/parse_gold_filttered\Phase2\Phase2_gold\hi_6400_gold.conllu,43,मैं फ्राइज़ खा रहा हूँ ।,6,SOV,Transitive,1.5
../Dialouge Corpus Filttered/parse_gold_filttered\Phase2\Phase2_gold\hi_6400_gold.conllu,59,मैं ने आज कार्ड पोस्ट कर दिया है न्यूयॉर्क ।,10,S-O-IO-V,Ditransitive,2.25
../Dialouge Corpus Filttered/parse_gold_filttered\Phase2\Phase2_gold\hi_6400_gold.conllu,65,मुझे बाकी के सभी एड्रेस चाहिए ।,7,SOV,Transitive,2.2
../Dialouge Corpus Filttered/parse_gold_filttered\Phase2\Phase2_gold\hi_6400_gold.conllu,77,वो वैसे ही बोल रहे थे कि मुझे एड्रेस दे दो अब ।,13,SOV,Transitive,2.1818181818181817
../Dialouge Corpus Filttered/parse_gold_filttered\Phase2\Phase2_gold\hi_6400_gold.conllu,122,उन्होंने मुझे भी डबल चार्ज किया ।,7,S-IO-O-V,Ditransitive,2.6
../Dialouge Corpus Filttered/parse_gold_filttered\Phase2\Phase2_gold\hi_6400_gold.conllu,131,तो हम ने वो किसी को दे दिया किसी और को ।,12,S-O-IO-V,Ditransitive,2.4
../Dialouge Corpus Filttered/parse_gold_filttered\Phase2\Phase2_gold\hi_6400_gold.conllu,141,म_मुझे तो उन्होंने बहुत चक्कर में पाया ना ।,9,OSV,Transitive,2.2857142857142856
../Dialouge Corpus Filttered/parse_gold_filttered\Phase2\Phase2_gold\hi_6400_gold.conllu,152,मुझे नंबर नहीं दिया ।,5,SOV,Transitive,2.0
../Dialouge Corpus Filttered/parse_gold_filttered\Phase2\Phase2_gold\hi_6400_gold.conllu,158,और उन्होंने फ़िर मेरे कार्ड पे भी डबल चार्ज कर दिया ।,12,SOV,Transitive,3.7
../Dialouge Corpus Filttered/parse_gold_filttered\Phase2\Phase2_gold\hi_6400_gold.conllu,161,आप कार्ड अपने पास रखें ।,7,SOV,Transitive,2.4
../Dialouge Corpus Filttered/parse_gold_filttered\Phase2\Phase2_gold\hi_6400_gold.conllu,179,तो हम तो ऐसा कर ।,6,SOV,Transitive,2.25
../Dialouge Corpus Filttered/parse_gold_filttered\Phase2\Phase2_gold\hi_6400_gold.conllu,184,एक तू ले लेती ।,5,OSV,Transitive,1.3333333333333333
../Dialouge Corpus Filttered/parse_gold_filttered\Phase2\Phase2_gold\hi_6400_gold.conllu,196,अभी तो मैं ने सब कुछ क्रेडिट करा लिया ना ।,11,SOV,Transitive,2.3333333333333335
../Dialouge Corpus Filttered/parse_gold_filttered\Phase2\Phase2_gold\hi_6400_gold.conllu,219,तो इसीलिए किया है कि डबल चार्ज बहुत सारे लोग को गए हैं ।,14,SOV,Transitive,2.75
../Dialouge Corpus Filttered/parse_gold_filttered\Phase2\Phase2_gold\hi_6400_gold.conllu,238,तब सभी को होता है भाई मैं मेंबर बनाऊंगा ।,10,SOV,Transitive,2.25
../Dialouge Corpus Filttered/parse_gold_filttered\Phase2\Phase2_gold\hi_6400_gold.conllu,283,आज कुछ ना कुछ बहाना बनाना पड़ेगा घर पे ।,11,SOV,Transitive,2.4444444444444446
../Dialouge Corpus Filttered/parse_gold_filttered\Phase2\Phase2_gold\hi_6400_gold.conllu,291,ये तो बहाने बनती रहती है ।,7,SOV,Transitive,1.6
../Dialouge Corpus Filttered/parse_gold_filttered\Phase2\Phase2_gold\hi_6400_gold.conllu,292,[incomprehensible] से तुम्हीं ख़ुद बात कर लो ।,8,OSV,Transitive,2.0
../Dialouge Corpus Filttered/parse_gold_filttered\Phase2\Phase2_gold\hi_6400_gold.conllu,355,हाँ आज तो वैसी पार्टी है क्योंकि उन लोगों ने छुट्टियां कर के कोई पार्टी रखी है ।,18,SOV,Transitive,3.0
../Dialouge Corpus Filttered/parse_gold_filttered\Phase2\Phase2_gold\hi_6400_gold.conllu,391,आज तो मैं ने उसी से कहा ना ।,9,SOV,Transitive,2.2857142857142856
../Dialouge Corpus Filttered/parse_gold_filttered\Phase2\Phase2_gold\hi_6400_gold.conllu,395,मुझे ना सभी लोग छोड़ के चले गए हैं ।,10,OSV,Transitive,1.625
../Dialouge Corpus Filttered/parse_gold_filttered\Phase2\Phase2_gold\hi_6400_gold.conllu,400,सभी लोग फ़न कर रहे हैं और मैं यहाँ पे काम कर रहा हूँ ।,15,SOV,Transitive,2.4615384615384617
../Dialouge Corpus Filttered/parse_gold_filttered\Phase2\Phase2_gold\hi_6400_gold.conllu,400,सभी लोग फ़न कर रहे हैं और मैं यहाँ पे काम कर रहा हूँ ।,15,SOV,Transitive,2.4615384615384617
../Dialouge Corpus Filttered/parse_gold_filttered\Phase2\Phase2_gold\hi_6400_gold.conllu,402,हमारा देखो हम कुछ नहीं करते ।,7,SOV,Transitive,2.2
../Dialouge Corpus Filttered/parse_gold_filttered\Phase2\Phase2_gold\hi_6400_gold.conllu,419,मैं ने इस को मना कर दिया है ।,9,SOV,Transitive,2.0
../Dialouge Corpus Filttered/parse_gold_filttered\Phase2\Phase2_gold\hi_6400_gold.conllu,443,मैं तुम्हे क्या बताऊँ ।,5,S-IO-O-V,Ditransitive,2.0
../Dialouge Corpus Filttered/parse_gold_filttered\Phase2\Phase2_gold\hi_6400_gold.conllu,492,अगर वो 8 खाती है तो फ़िर ये कितनी खाती है ।,12,SOV,Transitive,2.4
../Dialouge Corpus Filttered/parse_gold_filttered\Phase2\Phase2_gold\hi_6400_gold.conllu,492,अगर वो 8 खाती है तो फ़िर ये कितनी खाती है ।,12,SOV,Transitive,2.4
../Dialouge Corpus Filttered/parse_gold_filttered\Phase2\Phase2_gold\hi_6400_gold.conllu,515,तो फ़िर उन्होंने कुछ और देना था ।,9,SOV,Transitive,3.0
../Dialouge Corpus Filttered/parse_gold_filttered\Phase2\Phase2_gold\hi_6400_gold.conllu,597,हाँ हम क्रिसमस का कुछ नहीं किया ।,8,SOV,Transitive,2.8333333333333335
../Dialouge Corpus Filttered/parse_gold_filttered\Phase2\Phase2_gold\hi_6400_gold.conllu,618,लेकिन सुना है म्यूज़िक पैट्रॉल बहुत अच्छी पार्टी होगी ।,10,SOV,Transitive,2.125
../Dialouge Corpus Filttered/parse_gold_filttered\Phase2\Phase2_gold\hi_6400_gold.conllu,636,फ़िर वो तो अच्छी बात हुई ।,7,SOV,Transitive,2.4
../Dialouge Corpus Filttered/parse_gold_filttered\Phase2\Phase2_gold\hi_6400_gold.conllu,640,तो वो 50 ख़र्च रहा है ।,7,SOV,Transitive,1.8
../Dialouge Corpus Filttered/parse_gold_filttered\Phase2\Phase2_gold\hi_6400_gold.conllu,696,तो विक्की ने [incomprehensible] निकाला ।,6,SOV,Transitive,2.25
../Dialouge Corpus Filttered/parse_gold_filttered\Phase2\Phase2_gold\hi_6400_gold.conllu,716,बोलता नहीं मैं ने आप को देखा है ।,9,SOV,Transitive,2.857142857142857
../Dialouge Corpus Filttered/parse_gold_filttered\Phase2\Phase2_gold\hi_6400_gold.conllu,731,ना हम ने कुछ बोला नहीं ।,7,SOV,Transitive,2.0
../Dialouge Corpus Filttered/parse_gold_filttered\Phase2\Phase2_gold\hi_6400_gold.conllu,777,ये आप ने ना सिखा दिया उस को ।,10,S-O-IO-V,Ditransitive,2.125
../Dialouge Corpus Filttered/parse_gold_filttered\Phase2\Phase2_gold\hi_6400_gold.conllu,823,उस ने फ़ोन रख दिया ।,6,SOV,Transitive,1.5
../Dialouge Corpus Filttered/parse_gold_filttered\Phase2\Phase2_gold\hi_6400_gold.conllu,842,तो मैं ने सोचा वो ऐसे ही घर जा रही है पहले ।,13,SOV,Transitive,2.3636363636363638
../Dialouge Corpus Filttered/parse_gold_filttered\Phase2\Phase2_gold\hi_6400_gold.conllu,850,वो बोल रही है कि मुझे वापिस नहीं आना है क्योंकि मैं रट्गर्ज़ आती हूँ तो बहुत मुसीबत में पड़ जाती हूँ ।,23,SOV,Transitive,3.0
../Dialouge Corpus Filttered/parse_gold_filttered\Phase2\Phase2_gold\hi_6400_gold.conllu,851,मुझ से कुछ काम नहीं होता है ।,8,SOV,Transitive,1.8333333333333333
../Dialouge Corpus Filttered/parse_gold_filttered\Phase2\Phase2_gold\hi_6400_gold.conllu,854,तो बोलती है मैं वहाँ अपनी जॉब करुँगी ।,9,SOV,Transitive,2.4285714285714284
../Dialouge Corpus Filttered/parse_gold_filttered\Phase2\Phase2_gold\hi_6400_gold.conllu,872,तो फ़िर वो किसी से बात नहीं करेगी तो फ़िर वो मुसीबत में नहीं पड़ेगी ।,16,SOV,Transitive,3.7857142857142856
../Dialouge Corpus Filttered/parse_gold_filttered\Phase2\Phase2_gold\hi_6400_gold.conllu,872,तो फ़िर वो किसी से बात नहीं करेगी तो फ़िर वो मुसीबत में नहीं पड़ेगी ।,16,SOV,Transitive,3.7857142857142856
../Dialouge Corpus Filttered/parse_gold_filttered\Phase2\Phase2_gold\hi_6400_gold.conllu,877,क्योंकि वो अपने आप को कंट्रोल नहीं कर सकती है ना ।,12,SOV,Transitive,2.8
../Dialouge Corpus Filttered/parse_gold_filttered\Phase2\Phase2_gold\hi_6400_gold.conllu,901,तो उस ने खुद अपने भाई से बात की थी ।,11,SOV,Transitive,2.7777777777777777
../Dialouge Corpus Filttered/parse_gold_filttered\Phase2\Phase2_gold\hi_6400_gold.conllu,905,तो व्हाटएवर जब जैसे जैसे मैं कहूंगा वैसे वैसे करना है ।,12,OSV,Transitive,2.5
../Dialouge Corpus Filttered/parse_gold_filttered\Phase2\Phase2_gold\hi_6400_gold.conllu,911,तो पहले तो वो बोलती है मैं जॉब करुँगी ।,10,SOV,Transitive,2.125
../Dialouge Corpus Filttered/parse_gold_filttered\Phase2\Phase2_gold\hi_6400_gold.conllu,965,वहाँ पे ख़ैर पहले तो मेल तो चाचाजी ने खोली है ।,12,OSV,Transitive,3.3
../Dialouge Corpus Filttered/parse_gold_filttered\Phase2\Phase2_gold\hi_6400_gold.conllu,967,तो तेरा तो पहले ही सभी ने खोल दिया था ।,11,OSV,Transitive,2.7777777777777777
../Dialouge Corpus Filttered/parse_gold_filttered\Phase2\Phase2_gold\hi_6400_gold.conllu,1015,एक उस ने पास की है ।,7,OSV,Transitive,2.0
../Dialouge Corpus Filttered/parse_gold_filttered\Phase2\Phase2_gold\hi_6412_gold.conllu,9,ये कुछ रिसर्च कर रहे हैं हिन्दी वालों के लिए ।,11,SOV,Transitive,1.8888888888888888
../Dialouge Corpus Filttered/parse_gold_filttered\Phase2\Phase2_gold\hi_6412_gold.conllu,25,मेरे को तो हाई ब्लड प्रेशर हुआ हुआ है ना ।,11,SOV,Transitive,2.111111111111111
../Dialouge Corpus Filttered/parse_gold_filttered\Phase2\Phase2_gold\hi_6412_gold.conllu,31,वो शुगर वाला तो अभी वो हो गया ।,9,SOV,Transitive,2.5714285714285716
../Dialouge Corpus Filttered/parse_gold_filttered\Phase2\Phase2_gold\hi_6412_gold.conllu,42,और नीचे वाला 125 हो जाता है ।,8,SOV,Transitive,2.0
../Dialouge Corpus Filttered/parse_gold_filttered\Phase2\Phase2_gold\hi_6412_gold.conllu,45,डाक्टर क्या बोला ।,4,SOV,Transitive,1.5
../Dialouge Corpus Filttered/parse_gold_filttered\Phase2\Phase2_gold\hi_6412_gold.conllu,129,डॉक्टर क्या बोल रहा है ।,6,SOV,Transitive,1.5
../Dialouge Corpus Filttered/parse_gold_filttered\Phase2\Phase2_gold\hi_6412_gold.conllu,133,क्योंकि वो बॉडी जो है वो उतना ज्यादा चेंजिज़ ना वो नहीं कर पाती टॉलरेट नहीं कर पाती ।,19,SOV,Transitive,2.1176470588235294
../Dialouge Corpus Filttered/parse_gold_filttered\Phase2\Phase2_gold\hi_6412_gold.conllu,195,तो कल उस ने अल्ट्रासाउंड वगैरह किया और फ़िर वेट वो लोग कैल्क्युलेट करते हैं ना ।,17,SOV,Transitive,3.2
../Dialouge Corpus Filttered/parse_gold_filttered\Phase2\Phase2_gold\hi_6412_gold.conllu,195,तो कल उस ने अल्ट्रासाउंड वगैरह किया और फ़िर वेट वो लोग कैल्क्युलेट करते हैं ना ।,17,OSV,Transitive,3.2
../Dialouge Corpus Filttered/parse_gold_filttered\Phase2\Phase2_gold\hi_6412_gold.conllu,196,वो सब कुछ किया ।,5,SOV,Transitive,1.6666666666666667
../Dialouge Corpus Filttered/parse_gold_filttered\Phase2\Phase2_gold\hi_6412_gold.conllu,207,वो लोग हार्टबीट वगैरह वो करते हैं ।,8,SOV,Transitive,1.8333333333333333
../Dialouge Corpus Filttered/parse_gold_filttered\Phase2\Phase2_gold\hi_6412_gold.conllu,224,ऐसे तो उस ने कुछ बोला नहीं मतलब ऐसे [incomprehensible] ।,11,SOV,Transitive,2.111111111111111
../Dialouge Corpus Filttered/parse_gold_filttered\Phase2\Phase2_gold\hi_6412_gold.conllu,230,अभी मैं ने 2 वीक की छुट्टी ली ।,9,SOV,Transitive,2.7142857142857144
../Dialouge Corpus Filttered/parse_gold_filttered\Phase2\Phase2_gold\hi_6412_gold.conllu,239,लेकिन 2 वीक की मैं ने ले ली थी पहले ।,11,OSV,Transitive,2.3333333333333335
../Dialouge Corpus Filttered/parse_gold_filttered\Phase2\Phase2_gold\hi_6412_gold.conllu,261,तो तुम भी छुट्टी मार लेना ।,7,SOV,Transitive,2.0
../Dialouge Corpus Filttered/parse_gold_filttered\Phase2\Phase2_gold\hi_6412_gold.conllu,276,जो आप मतलब इंटर्व्यू देने गई थीं ।,8,SOV,Transitive,2.0
../Dialouge Corpus Filttered/parse_gold_filttered\Phase2\Phase2_gold\hi_6412_gold.conllu,279,उन लोग को बहुत एक्सपीरिएंस्ट पर्सन चाहिए था ।,9,SOV,Transitive,1.5714285714285714
../Dialouge Corpus Filttered/parse_gold_filttered\Phase2\Phase2_gold\hi_6412_gold.conllu,298,जूही को थोड़ा वायरल इंफेक्शन हो गया है ।,9,SOV,Transitive,1.8571428571428572
../Dialouge Corpus Filttered/parse_gold_filttered\Phase2\Phase2_gold\hi_6412_gold.conllu,308,आप को हमारा कार्ड मिल गया ।,7,SOV,Transitive,1.6
../Dialouge Corpus Filttered/parse_gold_filttered\Phase2\Phase2_gold\hi_6412_gold.conllu,345,तो उस समय फिर उस को सीसेक्शन करना पड़ा था ।,11,SOV,Transitive,2.7777777777777777
../Dialouge Corpus Filttered/parse_gold_filttered\Phase2\Phase2_gold\hi_6412_gold.conllu,383,क्योंकि हाई ब्लड प्रेशर में उस का डर रहता है ना कि सारे ऑर्गन्ज़ काम करना बंद कर सकते हैं ।,21,SOV,Transitive,2.6842105263157894
../Dialouge Corpus Filttered/parse_gold_filttered\Phase2\Phase2_gold\hi_6412_gold.conllu,458,ह्म वो उस का अड्वाइज़र क्या कर रहा है ।,10,SOV,Transitive,2.5
